{
  "domain": "effect",
  "version": "0.2",
  "status": "Draft",
  "initial_state": "PROPOSED",
  "states": ["PROPOSED", "AUTHORIZED", "DENIED", "EXECUTING", "EXECUTED", "OUTCOME_UNKNOWN", "RECONCILED", "VERIFIED", "VERIFY_FAILED", "COMPENSATING", "NOT_EXECUTED", "COMMITTED", "ABORTED", "QUARANTINED"],
  "terminal_states": ["DENIED", "NOT_EXECUTED", "COMMITTED", "ABORTED", "QUARANTINED"],
  "transitions": [
    {"from":"PROPOSED","to":"AUTHORIZED","reason_codes":["AUTHORIZATION_GRANTED"],"guards":["intent_persisted","parameters_and_idempotency_key_fixed","authorization_current"],"required_evidence":["intent","authorization_decision"]},
    {"from":"PROPOSED","to":"DENIED","reason_codes":["AUTHORIZATION_DENIED"],"guards":["denial_decision_final_for_request"],"required_evidence":["authorization_decision"]},
    {"from":"AUTHORIZED","to":"EXECUTING","reason_codes":["DISPATCHED"],"guards":["fencing_epoch_current","idempotency_binding_valid","capability_and_revocation_current","intent_durably_persisted"],"required_evidence":["dispatch_event"]},
    {"from":"EXECUTING","to":"EXECUTED","reason_codes":["EXECUTION_CONFIRMED"],"guards":["receipt_matches_intent_and_idempotency_key"],"required_evidence":["execution_receipt"]},
    {"from":"EXECUTING","to":"NOT_EXECUTED","reason_codes":["NON_EXECUTION_CONFIRMED"],"guards":["authoritative_non_execution_evidence"],"required_evidence":["non_execution_receipt"]},
    {"from":"EXECUTING","to":"OUTCOME_UNKNOWN","reason_codes":["TIMEOUT_AFTER_DISPATCH","CONNECTION_LOST_AFTER_DISPATCH","RECEIPT_MISSING"],"guards":["execution_may_have_occurred"],"required_evidence":["dispatch_event","uncertainty_report"]},
    {"from":"EXECUTED","to":"RECONCILED","reason_codes":["RECONCILIATION_CONFIRMED_EXECUTED"],"guards":["reconciliation_result_equals_executed","reconciliation_binds_original_idempotency_key"],"required_evidence":["reconciliation_report"],"metadata":{"reconciliation_result":"executed"}},
    {"from":"OUTCOME_UNKNOWN","to":"RECONCILED","reason_codes":["RECONCILIATION_CONFIRMED_EXECUTED"],"guards":["reconciliation_result_equals_executed","reconciliation_binds_original_idempotency_key"],"required_evidence":["reconciliation_report"],"metadata":{"reconciliation_result":"executed"}},
    {"from":"OUTCOME_UNKNOWN","to":"RECONCILED","reason_codes":["RECONCILIATION_CONFIRMED_NOT_EXECUTED"],"guards":["reconciliation_result_equals_not_executed","reconciliation_binds_original_idempotency_key"],"required_evidence":["reconciliation_report"],"metadata":{"reconciliation_result":"not_executed"}},
    {"from":"OUTCOME_UNKNOWN","to":"RECONCILED","reason_codes":["RECONCILIATION_STILL_UNKNOWN"],"guards":["reconciliation_result_equals_still_unknown","reconciliation_binds_original_idempotency_key"],"required_evidence":["reconciliation_report"],"metadata":{"reconciliation_result":"still_unknown"}},
    {"from":"RECONCILED","to":"VERIFIED","reason_codes":["POSTCONDITION_PASSED"],"guards":["reconciliation_result_equals_executed","verification_binds_fixed_post_state","verification_current"],"required_evidence":["reconciliation_report","verification_report"],"metadata":{"reconciliation_result":"executed"}},
    {"from":"RECONCILED","to":"VERIFY_FAILED","reason_codes":["POSTCONDITION_FAILED","POSTCONDITION_INCONCLUSIVE","VERIFICATION_EXPIRED"],"guards":["reconciliation_result_equals_executed","verification_binds_fixed_post_state"],"required_evidence":["reconciliation_report","verification_report"],"metadata":{"reconciliation_result":"executed"}},
    {"from":"RECONCILED","to":"NOT_EXECUTED","reason_codes":["RECONCILIATION_CONFIRMED_NOT_EXECUTED"],"guards":["reconciliation_result_equals_not_executed"],"required_evidence":["reconciliation_report"],"metadata":{"reconciliation_result":"not_executed"}},
    {"from":"VERIFIED","to":"COMMITTED","reason_codes":["COMMIT_AUTHORIZED"],"guards":["verification_still_current","expected_state_version_matches","commit_authority_matches","capability_and_revocation_current"],"required_evidence":["verification_report","commit_decision"]},
    {"from":"VERIFIED","to":"ABORTED","reason_codes":["COMMIT_ABORTED","PRECONDITION_CHANGED"],"guards":["abort_authorized","residual_effect_disposition_recorded"],"required_evidence":["abort_decision","residual_effect_disposition"]},
    {"from":"VERIFY_FAILED","to":"ABORTED","reason_codes":["VERIFICATION_FAILURE_ACCEPTED"],"guards":["abort_authorized","residual_effect_disposition_recorded"],"required_evidence":["verification_report","abort_decision","residual_effect_disposition"]},
    {"from":"VERIFY_FAILED","to":"COMPENSATING","reason_codes":["COMPENSATION_AUTHORIZED"],"guards":["compensation_is_separate_governed_effect","independent_authorization_granted"],"required_evidence":["verification_report","compensation_intent","authorization_decision"]},
    {"from":"VERIFY_FAILED","to":"QUARANTINED","reason_codes":["VERIFICATION_UNSAFE_UNKNOWN","COMPENSATION_UNAVAILABLE"],"guards":["normal_commit_disabled"],"required_evidence":["verification_report","quarantine_decision"]},
    {"from":"COMPENSATING","to":"ABORTED","reason_codes":["COMPENSATION_VERIFIED"],"guards":["compensation_effect_committed_or_safe_terminal"],"required_evidence":["compensation_effect","verification_report","abort_decision"]},
    {"from":"COMPENSATING","to":"QUARANTINED","reason_codes":["COMPENSATION_FAILED","COMPENSATION_OUTCOME_UNKNOWN"],"guards":["normal_commit_disabled"],"required_evidence":["compensation_effect","quarantine_decision"]},
    {"from":"RECONCILED","to":"COMPENSATING","reason_codes":["COMPENSATION_AUTHORIZED"],"guards":["reconciliation_result_equals_still_unknown","compensation_is_separate_governed_effect","independent_authorization_granted"],"required_evidence":["reconciliation_report","compensation_intent","authorization_decision"],"metadata":{"reconciliation_result":"still_unknown"}},
    {"from":"RECONCILED","to":"QUARANTINED","reason_codes":["RECONCILIATION_STILL_UNKNOWN","SAFE_RECOVERY_UNAVAILABLE"],"guards":["reconciliation_result_equals_still_unknown","normal_commit_disabled"],"required_evidence":["reconciliation_report","quarantine_decision"],"metadata":{"reconciliation_result":"still_unknown"}}
  ]
}
